[
  {
    "actor_ref": "actor:coordinator",
    "authority": "NONE",
    "base_revision": "cf6c55fe5fadd389dcd34132514b88e1bc92bcd8",
    "blocker_code": null,
    "budget": {
      "max_model_calls": 30,
      "max_repair_loops": 0,
      "max_token_or_cost_units": 5.0,
      "max_turns": 8,
      "max_wall_seconds": 2820
    },
    "candidate_revision": null,
    "event_id": "evt-8b805f19-ff40-4770-a461-f108cac6046e",
    "executor_ref": "executor:claude-code",
    "expected_output_schema": "sovereign.sscm-implementer-result.v0.1",
    "input_refs": [],
    "mission_id": "mission-sscm-01a-live-4",
    "observed_at": "2026-09-07T03:06:27.626Z",
    "output_refs": [
      {
        "kind": "FILE",
        "ref": "run:mission-sscm-01a-live-4:artifacts/coordinator-instruction.json",
        "sha256": "b76f8290800fc7811e68e41ef4b87cbcb3a5cacd2a246b331657adbc2e091520"
      },
      {
        "kind": "RECEIPT",
        "ref": "run:mission-sscm-01a-live-4:artifacts/coordinator-run.json",
        "sha256": "5a2ce2b673fd3153d4b49ada29af1de206460ab62e3c7272153721eddf805edc"
      }
    ],
    "predecessor_event_id": null,
    "schema_version": "sovereign.a2a-collaboration-event.v0.1",
    "session_ref": "5e16cf71-2b26-480b-844c-ce959534f061",
    "status": "PENDING",
    "target_role": "IMPLEMENTER",
    "task_id": "task:implement",
    "verb": "PUBLISH",
    "workspace_ref": null
  },
  {
    "actor_ref": "actor:implementer",
    "authority": "NONE",
    "base_revision": "cf6c55fe5fadd389dcd34132514b88e1bc92bcd8",
    "blocker_code": null,
    "budget": {
      "max_model_calls": 30,
      "max_repair_loops": 0,
      "max_token_or_cost_units": 5.0,
      "max_turns": 8,
      "max_wall_seconds": 2820
    },
    "candidate_revision": null,
    "event_id": "evt-7988ea36-623a-4d3d-80b8-f20fa8641c20",
    "executor_ref": "executor:codex",
    "expected_output_schema": null,
    "input_refs": [
      {
        "kind": "FILE",
        "ref": "run:mission-sscm-01a-live-4:artifacts/coordinator-instruction.json",
        "sha256": "b76f8290800fc7811e68e41ef4b87cbcb3a5cacd2a246b331657adbc2e091520"
      }
    ],
    "mission_id": "mission-sscm-01a-live-4",
    "observed_at": "2026-09-07T03:06:27.853Z",
    "output_refs": [],
    "predecessor_event_id": "evt-8b805f19-ff40-4770-a461-f108cac6046e",
    "schema_version": "sovereign.a2a-collaboration-event.v0.1",
    "session_ref": null,
    "status": "ACTIVE",
    "target_role": "IMPLEMENTER",
    "task_id": "task:implement",
    "verb": "CLAIM",
    "workspace_ref": "/home/kowen9024/sovereign/.sovereign/runs/mission-sscm-01a-live-4/workspaces/implementer"
  },
  {
    "actor_ref": "actor:implementer",
    "authority": "NONE",
    "base_revision": "cf6c55fe5fadd389dcd34132514b88e1bc92bcd8",
    "blocker_code": null,
    "budget": {
      "max_model_calls": 30,
      "max_repair_loops": 0,
      "max_token_or_cost_units": 5.0,
      "max_turns": 8,
      "max_wall_seconds": 2820
    },
    "candidate_revision": "3de5b82552f39d6c319f5171ed22911b4ca89d75",
    "event_id": "evt-f5681891-230f-4b85-ae99-64992ba98eb4",
    "executor_ref": "executor:codex",
    "expected_output_schema": null,
    "input_refs": [
      {
        "kind": "FILE",
        "ref": "run:mission-sscm-01a-live-4:artifacts/coordinator-instruction.json",
        "sha256": "b76f8290800fc7811e68e41ef4b87cbcb3a5cacd2a246b331657adbc2e091520"
      }
    ],
    "mission_id": "mission-sscm-01a-live-4",
    "observed_at": "2026-09-07T03:07:00.330Z",
    "output_refs": [
      {
        "kind": "FILE",
        "ref": "run:mission-sscm-01a-live-4:artifacts/implementer-result.json",
        "sha256": "c90dfcedd737ab5196783f052cd10a4acfe7b0b3179dca6452d6f1baf8ddb703"
      },
      {
        "kind": "RECEIPT",
        "ref": "run:mission-sscm-01a-live-4:artifacts/implementer-run.json",
        "sha256": "438716994678b4850df3b059cc8b855a460f04a504399b9c061ea180b1bd99df"
      }
    ],
    "predecessor_event_id": "evt-7988ea36-623a-4d3d-80b8-f20fa8641c20",
    "schema_version": "sovereign.a2a-collaboration-event.v0.1",
    "session_ref": "codex-thread:01a079d4-db7c-7af1-befb-1670155aca7a",
    "status": "SUCCEEDED",
    "target_role": null,
    "task_id": "task:implement",
    "verb": "COMPLETE",
    "workspace_ref": "/home/kowen9024/sovereign/.sovereign/runs/mission-sscm-01a-live-4/workspaces/implementer"
  },
  {
    "actor_ref": "host:sscm-mission-controller",
    "authority": "NONE",
    "base_revision": "cf6c55fe5fadd389dcd34132514b88e1bc92bcd8",
    "blocker_code": null,
    "budget": {
      "max_model_calls": 30,
      "max_repair_loops": 0,
      "max_token_or_cost_units": 5.0,
      "max_turns": 8,
      "max_wall_seconds": 2820
    },
    "candidate_revision": "3de5b82552f39d6c319f5171ed22911b4ca89d75",
    "event_id": "evt-53a220a4-a922-4f1c-981d-07d403c44942",
    "executor_ref": null,
    "expected_output_schema": null,
    "input_refs": [],
    "mission_id": "mission-sscm-01a-live-4",
    "observed_at": "2026-09-07T03:07:00.355Z",
    "output_refs": [
      {
        "kind": "FILE",
        "ref": "run:mission-sscm-01a-live-4:artifacts/host-candidate-verification.json",
        "sha256": "d42b36119bf70be3d81fa1750e787d699d0fb83faf631258a6f73f304cd74670"
      },
      {
        "kind": "REVISION",
        "ref": "git:3de5b82552f39d6c319f5171ed22911b4ca89d75",
        "sha256": null
      }
    ],
    "predecessor_event_id": "evt-f5681891-230f-4b85-ae99-64992ba98eb4",
    "schema_version": "sovereign.a2a-collaboration-event.v0.1",
    "session_ref": null,
    "status": "SUCCEEDED",
    "target_role": null,
    "task_id": "task:implement",
    "verb": "OBSERVE",
    "workspace_ref": "/home/kowen9024/sovereign/.sovereign/runs/mission-sscm-01a-live-4/workspaces/implementer"
  },
  {
    "actor_ref": "actor:reviewer",
    "authority": "NONE",
    "base_revision": "cf6c55fe5fadd389dcd34132514b88e1bc92bcd8",
    "blocker_code": null,
    "budget": {
      "max_model_calls": 30,
      "max_repair_loops": 0,
      "max_token_or_cost_units": 5.0,
      "max_turns": 8,
      "max_wall_seconds": 2820
    },
    "candidate_revision": "3de5b82552f39d6c319f5171ed22911b4ca89d75",
    "event_id": "evt-dfa24885-0143-47a4-967c-7cf526842a71",
    "executor_ref": "executor:claude-code",
    "expected_output_schema": null,
    "input_refs": [
      {
        "kind": "FILE",
        "ref": "run:mission-sscm-01a-live-4:artifacts/host-candidate-verification.json",
        "sha256": "d42b36119bf70be3d81fa1750e787d699d0fb83faf631258a6f73f304cd74670"
      },
      {
        "kind": "REVISION",
        "ref": "git:3de5b82552f39d6c319f5171ed22911b4ca89d75",
        "sha256": null
      }
    ],
    "mission_id": "mission-sscm-01a-live-4",
    "observed_at": "2026-09-07T03:07:00.779Z",
    "output_refs": [],
    "predecessor_event_id": "evt-53a220a4-a922-4f1c-981d-07d403c44942",
    "schema_version": "sovereign.a2a-collaboration-event.v0.1",
    "session_ref": null,
    "status": "ACTIVE",
    "target_role": "REVIEWER",
    "task_id": "task:review",
    "verb": "CLAIM",
    "workspace_ref": "/home/kowen9024/sovereign/.sovereign/runs/mission-sscm-01a-live-4/workspaces/reviewer"
  },
  {
    "actor_ref": "actor:reviewer",
    "authority": "NONE",
    "base_revision": "cf6c55fe5fadd389dcd34132514b88e1bc92bcd8",
    "blocker_code": null,
    "budget": {
      "max_model_calls": 30,
      "max_repair_loops": 0,
      "max_token_or_cost_units": 5.0,
      "max_turns": 8,
      "max_wall_seconds": 2820
    },
    "candidate_revision": "3de5b82552f39d6c319f5171ed22911b4ca89d75",
    "event_id": "evt-c26c26a5-7818-4ad6-a300-5966c48e8b8a",
    "executor_ref": "executor:claude-code",
    "expected_output_schema": null,
    "input_refs": [
      {
        "kind": "FILE",
        "ref": "run:mission-sscm-01a-live-4:artifacts/host-candidate-verification.json",
        "sha256": "d42b36119bf70be3d81fa1750e787d699d0fb83faf631258a6f73f304cd74670"
      },
      {
        "kind": "REVISION",
        "ref": "git:3de5b82552f39d6c319f5171ed22911b4ca89d75",
        "sha256": null
      }
    ],
    "mission_id": "mission-sscm-01a-live-4",
    "observed_at": "2026-09-07T03:07:28.629Z",
    "output_refs": [
      {
        "kind": "REVIEW",
        "ref": "run:mission-sscm-01a-live-4:artifacts/reviewer-result.json",
        "sha256": "a9c3317a0973f9be5925b4c9b6dad6ebb8c093da4162a3a11bed127202b3c9c6"
      },
      {
        "kind": "RECEIPT",
        "ref": "run:mission-sscm-01a-live-4:artifacts/reviewer-run.json",
        "sha256": "421a82f78b99e23a8f5c49f8226eff37506f9a8c90b84cd1cee80de7043a36b2"
      }
    ],
    "predecessor_event_id": "evt-dfa24885-0143-47a4-967c-7cf526842a71",
    "schema_version": "sovereign.a2a-collaboration-event.v0.1",
    "session_ref": "37ffd027-794a-4d02-989e-e059e01a86ab",
    "status": "SUCCEEDED",
    "target_role": null,
    "task_id": "task:review",
    "verb": "COMPLETE",
    "workspace_ref": "/home/kowen9024/sovereign/.sovereign/runs/mission-sscm-01a-live-4/workspaces/reviewer"
  },
  {
    "actor_ref": "host:sscm-mission-controller",
    "authority": "NONE",
    "base_revision": "cf6c55fe5fadd389dcd34132514b88e1bc92bcd8",
    "blocker_code": null,
    "budget": {
      "max_model_calls": 30,
      "max_repair_loops": 0,
      "max_token_or_cost_units": 5.0,
      "max_turns": 8,
      "max_wall_seconds": 2820
    },
    "candidate_revision": "3de5b82552f39d6c319f5171ed22911b4ca89d75",
    "event_id": "evt-643c3f48-ddd4-4dd0-9e15-ab602e320687",
    "executor_ref": null,
    "expected_output_schema": null,
    "input_refs": [],
    "mission_id": "mission-sscm-01a-live-4",
    "observed_at": "2026-09-07T03:07:28.646Z",
    "output_refs": [
      {
        "kind": "FILE",
        "ref": "run:mission-sscm-01a-live-4:artifacts/host-review-verification.json",
        "sha256": "917b1115a577be7583f6691987cbfcb51af15e1a715bccb91c89ddf5eed6a4a9"
      }
    ],
    "predecessor_event_id": "evt-c26c26a5-7818-4ad6-a300-5966c48e8b8a",